{"$schema":"../schemas/portfolio/dependence-policy.schema.json","allocation_authority":{"as_of_date":"2026-08-16","catalog_sha256":"0a9b5b243dc16786e41099dde6d02cd0c03431534bc50376352837f36d4734f4","generation_id":"20709bfd5f9a5846879854bf3166c11223a100cc62fcb13fe0b76040f881b542","manifest_sha256":"c5a1580b4a30480783b3ad54c8077687c2cf95bfe4c46ad1daf07c7d7f97ccf0"},"calculation_parameters":{"correlation_one_tolerance":"0.0000000001","eigenvalue_floor":"0.00000001","full_observed_weight_observations":500,"maximum_observed_weight":"0.4","minimum_downside_observations":20,"minimum_observations":30,"minimum_rolling_windows":1,"rolling_window":60,"stress_cap":"0.95","stress_uplift":"0.15","tail_quantile":"0.1"},"conceptual_priors":[{"evidence_note":"Frozen 2026-07 audit conceptual family prior; not measured data","left_strategy_id":"p123-ai-factor","right_strategy_id":"p123-eu","value":"0.65"},{"evidence_note":"Frozen 2026-07 audit conceptual family prior; not measured data","left_strategy_id":"p123-ai-factor","right_strategy_id":"qsi","value":"0.45"},{"evidence_note":"Frozen 2026-07 audit conceptual family prior; not measured data","left_strategy_id":"p123-ai-factor","right_strategy_id":"tt-portfolio","value":"0.45"},{"evidence_note":"Frozen 2026-07 audit conceptual family prior; not measured data","left_strategy_id":"p123-ai-factor","right_strategy_id":"volatis-strategy","value":"0.45"},{"evidence_note":"Frozen 2026-07 audit conceptual family prior; not measured data","left_strategy_id":"p123-ai-factor","right_strategy_id":"grizzlybears-vtma","value":"0.45"},{"evidence_note":"Frozen 2026-07 audit conceptual family prior; not measured data","left_strategy_id":"p123-ai-factor","right_strategy_id":"robuxio-crypto","value":"0.3"},{"evidence_note":"Frozen 2026-07 audit conceptual family prior; not measured data","left_strategy_id":"p123-eu","right_strategy_id":"qsi","value":"0.45"},{"evidence_note":"Frozen 2026-07 audit conceptual family prior; not measured data","left_strategy_id":"p123-eu","right_strategy_id":"tt-portfolio","value":"0.45"},{"evidence_note":"Frozen 2026-07 audit conceptual family prior; not measured data","left_strategy_id":"p123-eu","right_strategy_id":"volatis-strategy","value":"0.45"},{"evidence_note":"Frozen 2026-07 audit conceptual family prior; not measured data","left_strategy_id":"p123-eu","right_strategy_id":"grizzlybears-vtma","value":"0.45"},{"evidence_note":"Frozen 2026-07 audit conceptual family prior; not measured data","left_strategy_id":"p123-eu","right_strategy_id":"robuxio-crypto","value":"0.3"},{"evidence_note":"Frozen 2026-07 audit conceptual family prior; not measured data","left_strategy_id":"qsi","right_strategy_id":"tt-portfolio","value":"0.75"},{"evidence_note":"Frozen 2026-07 audit conceptual family prior; not measured data","left_strategy_id":"qsi","right_strategy_id":"volatis-strategy","value":"0.75"},{"evidence_note":"Frozen 2026-07 audit conceptual family prior; not measured data","left_strategy_id":"qsi","right_strategy_id":"grizzlybears-vtma","value":"0.75"},{"evidence_note":"Frozen 2026-07 audit conceptual family prior; not measured data","left_strategy_id":"qsi","right_strategy_id":"robuxio-crypto","value":"0.35"},{"evidence_note":"Frozen 2026-07 audit conceptual family prior; not measured data","left_strategy_id":"tt-portfolio","right_strategy_id":"volatis-strategy","value":"0.75"},{"evidence_note":"Frozen 2026-07 audit conceptual family prior; not measured data","left_strategy_id":"tt-portfolio","right_strategy_id":"grizzlybears-vtma","value":"0.75"},{"evidence_note":"Frozen 2026-07 audit conceptual family prior; not measured data","left_strategy_id":"tt-portfolio","right_strategy_id":"robuxio-crypto","value":"0.35"},{"evidence_note":"Frozen 2026-07 audit conceptual family prior; not measured data","left_strategy_id":"volatis-strategy","right_strategy_id":"grizzlybears-vtma","value":"0.75"},{"evidence_note":"Frozen 2026-07 audit conceptual family prior; not measured data","left_strategy_id":"volatis-strategy","right_strategy_id":"robuxio-crypto","value":"0.35"},{"evidence_note":"Frozen 2026-07 audit conceptual family prior; not measured data","left_strategy_id":"grizzlybears-vtma","right_strategy_id":"robuxio-crypto","value":"0.35"}],"history_authority":{"generation_id":"b2f2ea0519ddb2f06ef88297727a9317d3b43d4c2771304225b4da98f9ec46b3","outputs":{"coverage.json":{"sha256":"aa3aa24091f9edf24f231248a0e509cd680f40614c502a67d9ab07560b895e58","size_bytes":213410},"excluded.csv":{"sha256":"8eee0f630ee66b2280884623c71acc414e72665c44869949cc203b20a5807360","size_bytes":67},"live-only.csv":{"sha256":"5f0c499fe60536b72e1095fa18194e8e7386223187f41eb135f7de477a8c7006","size_bytes":324961},"live-plus-backtest.csv":{"sha256":"71170002a075f0f08fbba5211aa41915832cf0108347fcfbca8551a65d7c5409","size_bytes":3373604},"returns.csv":{"sha256":"71170002a075f0f08fbba5211aa41915832cf0108347fcfbca8551a65d7c5409","size_bytes":3373604},"segments.csv":{"sha256":"f542cb6d16d8092c45bcf20c9ff3e35ed17730e1de272e10be69743c370bf1ae","size_bytes":8053342}},"receipt_sha256":"54f9b3e1b168a8345938c01d6c59d12082bf3d6428e0267348e0d29b02c6a1de"},"owner_issue":336,"policy_id":"PORT-DEPENDENCE-1","schema_version":1,"series":[{"adverse_loss_fraction":"0.216625","allocation_weight":"0.12320999714360502","series_id":"AI Factor [P123]","strategy_id":"p123-ai-factor"},{"adverse_loss_fraction":"0.2299085840914843","allocation_weight":"0.08984989216554397","series_id":"EU [P123]","strategy_id":"p123-eu"},{"adverse_loss_fraction":"0.5912499999999999","allocation_weight":"0.14379451661370632","series_id":"QSI","strategy_id":"qsi"},{"adverse_loss_fraction":"0.2147017180299854","allocation_weight":"0.2388013485382236","series_id":"TT Portfolio","strategy_id":"tt-portfolio"},{"adverse_loss_fraction":"0.535","allocation_weight":"0.16198260380134283","series_id":"Volatis Strategy","strategy_id":"volatis-strategy"},{"adverse_loss_fraction":"0.3432903380422486","allocation_weight":"0.1219130051622533","series_id":"GrizzlyBears VTMA","strategy_id":"grizzlybears-vtma"},{"adverse_loss_fraction":"0.4899999999999999","allocation_weight":"0.11784392803035076","series_id":"Robuxio Crypto (High Sharpe High Vol)","strategy_id":"robuxio-crypto"}]}
